{
  "id": "job_42",
  "title": "Senior Platform Engineer",
  "description": "Build and operate HR Partner's API platform with a focus on reliability and developer experience.",
  "department": "Engineering",
  "location": "Sydney HQ (Hybrid)",
  "is_active": true,
  "published_date": "2026-05-01"
}
